{
  "$schema": "https://json-schema.org/draft/2020-12/schema",
  "$id": "https://sitebuilder.dev/schema/sequence.schema.json",
  "title": "Game bundle: project, spatial model, step library, scheduled tasks, gates and scenario in one file",
  "type": "object",
  "required": [
    "schema_version",
    "project",
    "storeys",
    "zones",
    "systems",
    "elements",
    "step_library",
    "tasks",
    "baseline",
    "scenario"
  ],
  "properties": {
    "schema_version": {
      "const": "1.0"
    },
    "project": {
      "$ref": "common.schema.json#/$defs/project"
    },
    "storeys": {
      "type": "array",
      "items": {
        "$ref": "common.schema.json#/$defs/storey"
      },
      "minItems": 1
    },
    "zones": {
      "type": "array",
      "items": {
        "$ref": "common.schema.json#/$defs/zone"
      },
      "minItems": 1
    },
    "systems": {
      "type": "array",
      "items": {
        "$ref": "common.schema.json#/$defs/system"
      }
    },
    "elements": {
      "type": "array",
      "minItems": 1,
      "items": {
        "type": "object",
        "required": [
          "guid",
          "ifc_class",
          "name",
          "storey_id",
          "zone_id",
          "cells",
          "visual"
        ],
        "properties": {
          "guid": {
            "type": "string"
          },
          "ifc_class": {
            "type": "string"
          },
          "name": {
            "type": "string"
          },
          "storey_id": {
            "type": "string"
          },
          "zone_id": {
            "type": "string"
          },
          "system_id": {
            "type": [
              "string",
              "null"
            ]
          },
          "cells": {
            "$ref": "common.schema.json#/$defs/cells"
          },
          "visual": {
            "type": "string"
          },
          "size_hint": {
            "type": "array",
            "items": {
              "type": "number"
            },
            "minItems": 3,
            "maxItems": 3,
            "description": "Approximate [w, h, d] in metres for the stand-in mesh"
          },
          "visual_kit": {
            "type": [
              "string",
              "null"
            ]
          },
          "member_guids": {
            "type": "array",
            "items": {
              "type": "string"
            }
          }
        }
      }
    },
    "step_library": {
      "$ref": "step_library.schema.json"
    },
    "tasks": {
      "type": "array",
      "minItems": 0,
      "items": {
        "allOf": [
          {
            "$ref": "element_step_map.schema.json#/$defs/task"
          },
          {
            "required": [
              "planned_start_day",
              "planned_finish_day"
            ],
            "properties": {
              "planned_start_day": {
                "type": "integer",
                "minimum": 0
              },
              "planned_finish_day": {
                "type": "integer",
                "minimum": 0
              }
            }
          }
        ]
      }
    },
    "baseline": {
      "type": "object",
      "required": [
        "finish_day",
        "finish_week",
        "total_cost",
        "critical_task_ids"
      ],
      "properties": {
        "finish_day": {
          "type": "integer",
          "minimum": 0
        },
        "finish_week": {
          "type": "integer",
          "minimum": 0
        },
        "total_cost": {
          "type": "number",
          "minimum": 0
        },
        "total_crew_days": {
          "type": "number",
          "minimum": 0
        },
        "critical_task_ids": {
          "type": "array",
          "items": {
            "$ref": "common.schema.json#/$defs/task_id"
          }
        },
        "weekly_planned_cost": {
          "type": "array",
          "items": {
            "type": "number"
          },
          "description": "Cumulative planned cost per week for the S-curve"
        }
      }
    },
    "scenario": {
      "$ref": "scenario.schema.json"
    },
    "generated_at": {
      "type": "string"
    },
    "generator": {
      "type": "string"
    },
    "packages": {
      "type": "array",
      "items": {
        "$ref": "common.schema.json#/$defs/package"
      },
      "description": "Optional; the game synthesises packages when absent"
    },
    "recipes": {
      "type": "array",
      "items": {
        "$ref": "recipe.schema.json"
      },
      "description": "Recipes applicable to this project (embedded so the game can explain and apply them)"
    },
    "manual": {
      "$ref": "manual_sequence.schema.json",
      "description": "Manual sequence merged into this bundle, if any"
    },
    "bundle_format": {
      "type": "object",
      "properties": {
        "compressed": {
          "type": "boolean"
        },
        "task_parts": {
          "type": "array",
          "items": {
            "type": "string"
          },
          "description": "Relative paths of task part files when tasks are split; tasks[] may then be empty"
        },
        "zone_detail_dir": {
          "type": "string"
        }
      }
    }
  }
}
